title,upvote
"Bi-Weekly /r/IOpsychology Discussion - What have you been reading, and what do you think of it?",1
"Interesting, startup meets corporate",31
Psych Major wanting to get into hr [resume question],12
"Free virtual conference for undergraduate students interested in obtaining a PhD in I/O, hosted by SIOP on Nov. 7th and 8th. Save the date!",24
Seeking employment in mid-career.,13
Ever Thought About Strikes? Development of a Scale to Assess Attitudes and Behavioral Reactions to Strikes,6
MS thesis on POPs and Knowledge Hiding in Higher ed Faculty,1
IO Psychology Articles that Everyone Should Read,44
Organizational Behavior vs I-O Psychology differences,6
OD Consultants: how do you put your experience on your resume?,10
Qualitative network analysis?,4
Beginner Resources for Network Psychometrics?,3
Recommendations?: Where to start an I/O Psych career?,6
Prepping for Masters in IO Psychology,5
[OC] I/O Psychology Salary Before and After Adjustment for Cost Of Living by State,60
Is this a good job offer?,14
How hard is it to learn Tableau?,5
Interview request - job shadow,10
I/O & Performance Psych,9
Amazon’s attrition costs $8 billion annually according to leaked documents. And it gets worse.,40
burnout studies in organizations,3
"Bi-Weekly /r/IOpsychology Discussion - What have you been reading, and what do you think of it?",6
Example of Job Analyses?,3
Reliability and validity,13
Do I/O Psych PhD programs suck your lifeblood?,25
Certificate in IO Psych vs. MA in IO Psych,5
Licensing,4
Engineering to IOP,2
"Experience using RevMan, Covidence or other software for a meta-analysis",5
Is it better to send corporate survey before Christmas or after New Year's?,6
IO psychology masters personal statement,14
"Currently a clinical Psych RA, contemplating shifting to an I/O career…what relevant experience do I need to apply to programs?",16
Consumer behaviour,1
Trying to get HR internship here with no experience. HELP!,16
psych studies published in non-psych journals,1
my predictive index results,6
Working in a corporation? career?,5
What burns you out in this field?,33
Who are some of the biggest unconventional team / leadership development consulting firms?,13
Team exercises?,10
"Bi-Weekly /r/IOpsychology Discussion - What have you been reading, and what do you think of it?",3
SIOP Conference too expensive?,14
What is the impact of forcing employees to commute back to work after working from home?,69
What/why do proposals get rejected from SIOP Annual Conference? What typically gets accepted?,6
"If someone said ""the way we work has not changed much since the industrial era"" what kind of data or proof would you identify to reinforce that?",3
How do you define personality?,3
Trying to find access to an article,8
IO resume question,6
What are you working on? - October 2022,3
From Finance into Psychology/Life Coaching,3
What is the highest paying jobs in IO Psychology?,25
Would appreciate advice.,2
Strategies on organizing citations,3
Looking for participants for my graduate capstone project,2
Masters in IO but no prior experience,1
Practitioner Conferences?,8
"Undergrad looking for internships, is HR my only realistic internship?",13
"As the economy heads into a potential recession, executives seek out consultants and organizational psychologists to reverse the trend.",9
The presentation(s) I most hope to see at SIOP23...,3
The absence of complaints is one of the surest sign of failing leadership,20
"""Orderliness is associated with slightly lower achievement."" Is this accurate?",0
"Is the personality trait ""Achievement-Striving"" the same as being ""Status-Seeking"" or are these different concepts?",1
Prominent Italians in I/O?,1
How to Generate data from rasch model in R ?,1
What are your thoughts and experiences regarding peer appraisal?,5
How often do you encounter BCBAs in this line of work?,1
"People with political skill are more likely to end up in leadership positions, but are people with political skill better leaders?",12
Where to sell old text books?,2
How to foster psychological safety at work?,6
Interview Request - Job Shadow,8
"Examples of work injustice, CWBs in tv shows, movies?",4
Case study resources?,7
What Is a Performance Management Cycle?,2
How to stop psychopaths and narcissists from winning positions of power?,0
"What do you think about Schein's books Humble Leadership, Humble Inquiry, Humble Consulting and his other books?",1
How often should you do team events?,1
Have you ever done a post-exit interviews?,4
Is IO Psychology for me?,9
OCCUPATIONAL HEALTH TOPIC + CAREER PATH,3
Literature Search/Sources,3
What are the best books about Machine Learning driven organizations?,9
Book recommendations for getting into change consulting practice,8
How do you define belongingness?,10
"Is it always true, that you shouldn't give people bonuses based on performance, because extrinsic motivation kills intrinsic motivation? What about job titles or other reputation symbols as rewards?",20
There is the saying that you can’t improve what you don’t measure. So how do you quantify employee performance?,8
MBTI vs Enneagram,0
Data driven organizations,46
What of note has been going on recently in business consulting and change management?,8
Leadership Development Benchmarking,4
The linkage between cognitive diversity and team innovation: Exploring the roles of team humor styles and team emotional intelligence via the conservation of resources theory,4
Counter argument,8
"Bi-Weekly /r/IOpsychology Discussion - What have you been reading, and what do you think of it?",2
Are there any free/affordable online learning resources for IO?,14
Why Warmth Is the Underappreciated Skill Leaders Need,2
Employee Assistance Programs - How can we improve them?,1
Personality assessment tools used while recruiting,3
A Brigham Young University study of 80 newly formed teams found that groups that played video games together for just 45 minutes were 20 percent more productive than those that engaged in more traditional team-building exercises.,75
Need advice on purchasing a index for use in a study,2
"A Massive LinkedIn Study Reveals Who Actually Helps You Get That Job - Acquaintances, more than close friends, show the strength of “weak ties” when it comes to employment",54
I/O psychology mentor - Talent management,8
Been having trouble finding a job right after getting my Masters,22
Predictive Index?,9
"What do you think about having two teams in your company with exactly the same tasks, and having them be rivals to each other?",10
Am I low-balling myself?,17
What can we learn from recruitment?,10
The war for talent - is it still a thing in 2022/2023?,6
Courses to supplement unrelated bachelors,2
Not sure how to continue learning I/O psych during undergrad,2
People who got their masters in IO with a BA in psych: What was your minor?,19
"E-leadership prevalence in post-pandemic workplace, thoughts?",4
Does anyone know of any books (academic or other) that do a good job highlighting the engagement research that has been and is coming out of social media?,3
Virtual interview nightmares,2
"Hi everyone, is anyone familiar with a predictive framework that uses customer a type of psychological profile of a customer to predict how a customer/client will value your business?",3
Scales of measurement,7
What do you think are the challenges that I/O psychologists are currently facing?,22
Is IO Psych inherently anti-labor? Why or why not?,28
Do you think it makes more sense to study combinations of Big 5 traits rather than individual traits?,2
Social Platform for Organizational Scholars Interested in Disability-Related Topics,2
Research has found that you are more convincing when you phrase your opinions in form of a story rather than just stating facts or referencing scientific papers. How can I learn to communicate more in stories?,13
Literature review topic on disabilities,7
I have an interview as a Talent Assessment Consultant and was hoping for some pointers.,25
Is it normal to have large differences between subtraits?,0
Mentioning company names in personal statement for Masters?,6
What are the most common I-side applied roles?,8
"Does someone with a more competitive personality or a more cooperative personality have more success when leading a business, when all other traits are equal?",2
Survey platform for independent contractor use?,9
"Bi-Weekly /r/IOpsychology Discussion - What have you been reading, and what do you think of it?",5
Any resources for tree models in psychometrics?,3
What are some survey question's to check whether employees are in the right place and are doing the right and most efficient work?,4
Do I/O Master's programs typically require you to be employed to do certain assignments/projects?,8
Best Journals in the Field,19
"Well, that's discouraging.",59
Research paper topic ideas,13
What keywords can I use to look for entry-level jobs in psychoanalytics,18
Recently laid off and looking for community help,19
What is the latest in IO Psych? How do you keep yourself up to date with the latest research and news?,29
Looking for research on retirement,7
What are you working on? - September 2022,5
Consulting billing?,35
Study Design - Retrospective Standardized Testing and Employment Outcomes,5
What's your vision/strategy and outcomes of learning & development in your company?,2
Link between DEI/wellbeing and Recruitment?,1
Interested in I/O. Coming from sales. Long shot? Need advice.,19
What are good primers on industrial/organizational Psychology?,9
Advice for the statistical portion of I/O Psych,14
looking for a job.,10
Just a quick question from some considering going into I/O psychology,7
Are we ever going to be able to change this?,36
What's your personal shortlist of companies that you'd like to work for? What makes them interesting to you?,22
"Currently in undergrad, I need answers about I-O.",6
Python and R courses online,23
Racial barriers to MSP world.,2
Assessment Strategy,6
"Bi-Weekly /r/IOpsychology Discussion - What have you been reading, and what do you think of it?",6
Textbook help,9
Looking for advice on how to organize L&D in tech product company,7
Has anyone ever worked for a company where they actually did job analyses? (During or before you practiced I/O),16
Difficulty of Master's Program?,10
Looking for research on differences in requirements (KSAOs) by job clusters / job families,3
what do IO psychologist do?,6
Working from Home,18
MS in IO? Need Advice,7
Companies that pay for your program,2
Tips to get into People Analytics role,18
The Rise of the Worker Productivity Score - automated worker tracking for the purposes of performance management,31
Who are the leading academics/practitioners in the field that study/develop unobtrusive measures?,4
I/O Intern asking for advice and guidance!,8
IO psychology to the rescue!,46
Gift ideas for an IO Psychologist?,11
"For those in the IOP field - students, professionals, professors, etc",1
I-O to business analyst career path?,21
Is an I/O background useful for project management?,21
Pay Transparency Strategy,11
the logistical issue for completing a competency model across 50 job families with unique behaviors for each career level (20 total).,17
"Bi-Weekly /r/IOpsychology Discussion - What have you been reading, and what do you think of it?",2
Any airlines that hire I/O Psychologists?,19
"I/Os on an island who eventually built your own team, how did you do it?",23
Interpretable machine learning models,4
Tips for breaking into people/talent analytics?,10
The Many Forms of Toxic Leadership Article,10
Knowledge diversity and hierarchy affect team effectiveness. Diverse teams function well only under the right leadership structure.,15
"Im at a loss on what to do for my future career in psychology, can ya'll give me some ideas?",5
Digital nomad and IO,8
5/6 months until I start applying for Masters - what do I do?,4
Undergrad research,9
What knowledge derived from the study of psychology is practical?,0
People Analytics?,29
Need a shorter assessment for employee works styles that can be used to facilitate team development,4
I am stuck in my career. Where do I go from here?,13
Can social impact programs amplify employee voice and create a positive DEI environment in the workplace? A webinar got me thinking.,5
I/O vs Business Psychology,9
Lack of psychological safety,7
Should one attain a BS or BA degree in undergrad when the goal is to pursue a graduate degree in I/O Psych? Or does it not matter?,8
What are you working on? - August 2022,3
EI/EQ Training Resources,2
Managing People Help,17
BS Psych Major in undergrad. Is Minor in Neuroscience going to be useful?,11
Do you do Org Development / Org Effectiveness Work?,23
RStudio is rebranding to Posit in an effort to expand beyond the R community,22
Do you think it makes sense to have everyone employee do a public self-assesment at the end of a project and/or an others-assesment?,1
PhD advisors with emphasis on personality/intelligence?,4
"Age, salary, years of experience and job satisfaction/work life balance? How many hours do you work per week? What’s your position?",51
Is IO still worth it if I don’t want to live in big cities? How’s the job market looking due to current lay off in big companies?,6
"Bi-Weekly /r/IOpsychology Discussion - What have you been reading, and what do you think of it?",7
Break before Grad school,14
Looking for recent (or must read) articles on the IAT,2
"Difference between Job rotation, Job enlargement, and Job enrichment",8
Democracy in the Workplace,8
"Frameworks/models for ""good job"" other than Job Characteristics Model?",13
"Are the cognitive skills of ""deductive and inductive reasoning"" considered ""pattern recognition""? Or, are they separate from ""pattern recognition""?",13
Looking for measures of applicants' acceptance of test batteries,3
Certain practices more/less effective depending on cultural context?,7
U.S. Department of Justice opens probe into Maryland State Police over possible racial discrimination in hiring and promotions,19
Potential jobs with an MSc IOBP degree in the UK?,3
Excel course for People analytics role starting out?,11
Masters Thesis - Artificial Intelligence based scenarios,2
Are there studies on “work speak”/the common lying that goes on?,22
Undergrad job search,15
"Followup question on ADKAR question from earlier this week- Commenters mentioned using ADKAR with Kotter or Lewin's theories. That makes sense, but in your opinion, do clients or hiring employers care about other methods when ADKAR/Prosci is repeated everywhere as THE CERTIFICATION?",6
Early IO experience,6
Does Your School Conduct Research on Teams?,7
Books about management,2
Asking for a raise / post graduation,6
is the adkar model of change just a product? or is it,11
"Bi-Weekly /r/IOpsychology Discussion - What have you been reading, and what do you think of it?",3
How binding is a PhD in IO Psychology? Could you still teach other topics within psychology? Could you open a clinical practice?,5
"If my dream is to teach psychology at the university level, should I get a PhD in IO?",4
I-O Psychology jobs,11
Scope for IO Psychology in UK?,4
Where do you find surveys to use?,14
Recent college graduate,5
If you could do it all over... Would you still choose IO?,19
Research funding in Management Departments,1
I/O career down the drain,23
Meet up at AOM,2
Looking for citations for recruiting method,4
Prioritizing people ops,10
Factors that influence the type of occupation a person gets into,8
Job title?,20
IO psyc job prospects in Canada (Quebec and Ontario?),6
Community Funds applications are open!,1
Literature on phrasing open-ended questions / interview-questions,0
What are you working on? - July 2022,2
Jobs I/O Related (Post-grad),10
Pre I-O Jobs,16
Expectations vs Reality?,24
Questionnaire For Org About Internal Candidate’s Perceived Potential to be CEO ?,3
I-O Psychology Academic Tree,20
How useful is data science in I/O Psychology?,3
Is marketing part of my job??,12
"Bi-Weekly /r/IOpsychology Discussion - What have you been reading, and what do you think of it?",6
Best material to learn about performance appraisal/management?,8
IO certification options,12
How do I/O’s help both management AND employees at the same time?,3
Breaking into I/O Psychology with a BA in Psychology,24
I/O as a Career? Thoughts? Losing an organ derailed me,1
Performance management,3
What do you all think about mediation analyses on cross-sectional data?,10
Hi. I reviewed the rules and think this acceptable here: Completed MA I/O Psych and seeking advice for part-time consulting employment,7
Career paths with IO psych?,18
"When and why does status threat at work bring out the best and the worst in us? A temporal social comparison theory (Organizational Psychology Review, 2022)",5
"Workplace politics: how to make an executive committee comprised of ambitious, political, and competitive people work.",13
Digital Nomads,22
Get a second bachelor’s degree?,6
Assessment methods for skills,1
Wage gap…,26
IO Psych Student - Tell me what I should know!,4
What is the most frequent type of analysis you conduct at work?,3
"What are current trends, buzzwords and concepts in the applied setting?",6
What other courses would you go for?,4
"Hello, an Indian candidate here. Are there any Indian online reviews or journals equivalent to HBR and the likes?",1
how does the industry of I/O Psych treat tattoos and piercings?,3
Employee Referral Programs,10
project need responses,1
Reasoning score anology,1
"Bi-Weekly /r/IOpsychology Discussion - What have you been reading, and what do you think of it?",3
Has anyone successfully used their skills after getting a dual IO/MBA Degree?,13
I/O Career.,8
Interested in OD/OBM consulting - how essential is grad school?,5
Why does everyone hate The Chicago School of Professional Psychology?,29
(Re-)live in-person SIOP 2022 with this funny highlights reel!,5
ADVICE NEEDED: Path to IO Psych Professor,6
Breaking into I/O,5
Phd IO Psych Stipend,11
Should I take the job?,11
Have you ever helped a friend or family member with finding a suitable career for them?,13
"Associations Between Occupational Status, Support at Work, and Salivary Cortisol Levels",11
Need advice before opting for a masters.,8
Remote work posts: an evidence-based reviews,22
I know this question may sound a little dumb but what do you do everyday in the office?,25
Are there any good online resources to learn the math/statistics part of IO Psychology?,19
Non-Psych Graduate Needs Advice,2
Are there I/O psychologists that work for the video game industry?,16
What's it like working as an IO psychologist?,2
SPSS statistical data,0
Recent Master's Grad looking for job help,15
"Working on an article for common stats methods in our field, however topics on regression are all over the place.",4
What's the most revolutionary paper in io-psych in the last year?,28
What are you working on? - June 2022,1
"Bi-Weekly /r/IOpsychology Discussion - What have you been reading, and what do you think of it?",10
Book recommendations,16
Does something like the O*NET exist in other countries?,22
Normative vs. Ipsative personality tests in selection,14
Differences between IO Psychology and Software Engineering?,12
Is there research/ what is your experience with this - Perceptions of unfairness when blind selection results in non-diverse outcomes,10
Top tier company but shitty job position,5
I need suggestions for the intervention of work teams in the field of organizational development,4
"Job-seekers prefer to work for more diverse companies - ""A new study finds that job seekers are even willing to explore jobs with lower salaries when companies are more diverse.""",19
What are good companies and titles that are relevant into getting a good occupation once I obtain my Bachelors in IO Psychology?,6
IO and Data Science/Analytics Question,15
What Excel skills are most important to know for a career in this field?,21
Using the PAI as part of selection,2
What should I read to learn more about the relationship between workforce diversity and organizational performance?,10
Looking for audio book recommendations,15
Name vs program,11
Can I talk to any IO psychologists? Basic questions for someone interested in learning about how life as an IO psychologist is.,9
Resume vs. CV,1
Clinical psych masters student looking at I/O,3
Professor career outlook?,7
what do your jobs consist of daily?,23
Fall 22 PhD Admits I/O,11
Advice for activities during a gap year,8
"Bi-Weekly /r/IOpsychology Discussion - What have you been reading, and what do you think of it?",9
Case Interview for Consulting Jobs,8
Talent Acquisition and Recruitment,5
Disappointing Job Search,22
What should I do to help build my resume for IO,11
Lost undergrad in need of some guidance,2
Good Books About Team Member Archetypes?,2
Those who got their masters outside the US,1
"Is Job experience, or research experience more important for MA?",7
Seeking advice/ opinions!,0
Where to find conferences related to HR / Psychology / OD,3
Would I be a good fit for IO psychology? Would I be interested?,13
Data Analysis & Insights!,7
Is there research around optimal amounts of PTO for employees to take?,23
USA I/O PhD Salary/Stipend,6
Post-Grad Plans,2
Will my GPA kill me in grad school apps?,2
Help developing research question on AI in work,7
Undergrad student looking for advice on the field,13
Business Psych undergraduate,5
Cry for help: thesis on disidentification,11
Research relating to game-based assessments?,14
What to read next?,2
Tests of General Mental Ability for personnel selection that avoid bias?,3
What should I read to learn about pay for performance?,11
Being thick-skinned vis-a-vis enduring toxic culture.,4
Is broad or focused experience better?,9
Job titles/Industry,5
Got a stack of grad school textbooks I’m probably never gonna use again. What’s the best way to donate them?,58
Are performance reviews illegal for global independent contractors?,2
Books for sharing,2
Applying to NSF GRFP?,5
What are the cornerstones of a good onboarding procedure?,8
What’s you’re favorite IO topic from the movie “Office Space” (1999)?,35
Question,9
"Telework satisfaction, wellbeing and performance in the digital era. Lessons learned during COVID-19 lockdown in Spain",9
Question about being a Recruiter for a company such as McKinsey,11
Survey wording question,5
Podcasts for commute,13
Baruch Executive Master in IO,6
What tools do IO Psychologists use?,8
"Bi-Weekly /r/IOpsychology Discussion - What have you been reading, and what do you think of it?",5
SIOP COVID transmission,42
Organizational demography,3
"SIOP after action discussion. Share the good, bad, and memorable thoughts and experiences here.",32
What research/ area/ article should managers in an organization be specifically reading or following?,11
Looking for information on technology-based assessments (preferably systematic reviews or meta-analysis) - any recommendations?,4
What are you working on? - May 2022,7
Suggestions for how to keep up with IO Psychology research? - Specifically meta-analysis and systematic literature reviews,33
Is the Chicago School of professional psychology a bad school?,4
I got accepted to UGAs IOMP!!!,19
Atlanta vs Dallas for IO Jobs,5
Is there any way for getting access to Academy of Mgmt articles (w/o paying for it?) Sci hub doesn't seem to find those articles. pls help,3
Who's at SIOP?,6
"The comments in this thread are so misinformed. As a discipline, how can we do better at demonstrating that pre-hire assessments are valid [not pseudoscience]?",16
"Am I getting paid enough? I recently defended my dissertation after 8 years grad school experience, I was abd for 2 years (thanks COVID), and have been at my company full time for 1.5 years. I’m also required to come into the office full time and live in San Diego. I make 103k base salary…",15
Do I stand a chance?,17
what were your graduate school classes like?,10
Will studying IO be useful for HR? What research can I do in the field of IO to show my interest in HR?,21
Entering IO Psych. profession with a Social Psych. graduate degree,5
A question about Herzberg’s two-factor theory,5
Question: can an undergrad IO degree be used in a sports organization?,6
How do you apply machine learning techniques to IO concepts?,16
Humanitarian Work Psychology,12
Career advice needed please,9
Hello everyone! I did a psychometric test for a company. I googled it but can't find it. I had to draw straight lines (of a character size) and as many as possible during 1min intervals by 5min. Does anyone know what the test is called or what it is for? I attach an example.,21
Jobs in I/O,22
"Looking for studies comparing remote versus office workers' performance. Specifically, something about bias, heuristics, etc. Any suggestions?",16
Scales for Role Ambiguity/Conflict?,1
How do you dress for your job and what type of bag do you use?,16
Looking for highly regarded research on succession planning.,12
Is it crucial to have a business major background prior to MS in IO Psych?,8
Have any of you done freelancing or used Upwork?,11
Research,1
"Bi-Weekly /r/IOpsychology Discussion - What have you been reading, and what do you think of it?",2
How often is social network analysis methods used in IO?,11
Organizational Development Careers/Career Path,6
SIOP Conference First-timer,5
Most Respected/Top IO Psych Programs?,25
Research on Personnel Selection,5
AlixPartners Assessments,3
Building an inclusion network,7
Intern experience,8
Asking for a raise/promotion,17
HELP! Looking to interview an IO Psychologist,8
Anyone Else Having Latency Issues with SIOP Webpage?,6
Career Advice,3
How much writing do you do as an IO psychologist?,11
Good book to start?,2
what is the difference between Industrial and Organizational Psychology?,5
Wharton is hosting a HR data case competition for students. The winner receives $10K USD - check it out!,22
