title,upvote
Undergrad Internships,2
Starting a job at a startup where I will be building their HR/People Function from scratch. Which books/research papers should I read?,40
career advice.,0
Undergraduate student going into a IO masters.,4
assessment instrument ideas?,3
The official IO psychology discord!,26
Is there any evidence that psychology graduates are better fakers in personality measures than graduates from other majors? Any thought would be helpful,4
Should I do a master's right after my bachelor degree or get work experience first?,9
SIOP Question,3
Do IO Psychology consulting firms need a PHD?,11
How common is it for I/O psychologists to work with Labor Unions?,25
"Job Opportunity - People, Science, and Strategy Manager, San Francisco Public Utilities Commission",2
Where should I study?,3
how will my clinical research experience in psychology be useful for IO psych field?,8
Testing for employee selection,12
what’s the best field in i/o for introverts?,14
nyc area,1
General Advice Needed,11
How did you structure your CV when applying for research roles in industry?,5
Double major in Psychology and Business Analytics?,15
Does anyone have any articles they really liked for the following 2 topics:,6
How can I specialize in a field that combines I-O psychology but also uses clinical psychology?,13
IO psychology for r/place,6
What is a typical day at work for you I/O psychologists?,35
2022 Grad School Q&A Mega-Thread,27
What are you working on? - April 2022,12
Employee Engagement Surveys…w no demographics?,6
Research into human flourishing?,8
Recommendations on theoretical frameworks,9
SIOP Salary Survey open through April 10!,40
Interactive report on burnout at work — 2 in 5 workers at high risk of burning out [upvote if you can],24
Would anyone in this field be willing to talk to me about what a PhD is like and what happens after?,15
Publicly available I/O datasets for an SEM analysis?,2
A Conceptual Framework of How Meeting Mindsets Shape and Are Shaped by Leader–Follower Interactions in Meetings,2
New US News Rankings,12
Thoughts on University of Houston’s PhD program?,2
Looking for help from I/O R enthusiasts for my upcoming I/O coding Discord community,39
What are your best tips for a junior applying to a mix of masters and PhD programs next fall?,11
Thoughts on MS Org Leadership?,7
UWES Help,6
HR Project Management as a Career Path,8
Help Deciding !,2
Salary as PhD student,10
How to help students understand criterion development?,9
Paul Spector: A New I/O Faculty Retention Problem,32
"Bi-Weekly /r/IOpsychology Discussion - What have you been reading, and what do you think of it?",1
Positive Organizational psychology,12
IO relevant job market in US vs UK,12
"Thinking About Thinking About Work: A Meta-Analysis of Off-Job Positive and Negative Work-Related Thoughts (Journal of Business and Psychology, 2021)",29
Career Pathways - Data?,5
Anyone else finds parameter estimation in psychometrics too tough ?,3
Need to interview a consultant,10
Which undergraduate lab experience will boost my IO Ph.D. application?,10
Graduate Certificate in IO Psychology,15
Looking for entry-level IO Psychology roles in consulting - what kind of keywords should I use to search?,21
if you're looking for io career advice,37
Advice on future job interview?,0
Wondering if things I have done/have lined up could gear me for an IO career?,2
Best places to do an internship,9
What’s your story?,22
Is I/O Psychology Merely Glorified Human Resources?,3
Looking to do qualitative research about organizational culture in tech startups - ideas for specific research questions within this?,1
"IOs that aren't in strictly ""IO Psychology"" roles (like HR Generalist, Talent Acquisition, etc), how do you bring your knowledge of psychology to your role? I'd love some examples!",38
Project Management?,7
Looking for academia to industry perspectives and experiences,15
"What are your thoughts on personality tests' value as a selection tool, whether it be as a hurdle used to screen candidates out of consideration in the hiring process, or used in conjunction with other tools (e.g., work samples, interviews) to help inform final hiring decisions?",20
Skills-Based Hiring,8
So....who's heading to the SIOP Seattle conference in April?,17
What jobs would allow me to conduct research in organizations with only a Master's in IO,11
Advice deciding between REU's,3
Considering a change from Social Work to I/O Psych.,10
High5Test.com Support is the worst,0
Seeking a brief virtual chat with an I/O professional.,9
"Bi-Weekly /r/IOpsychology Discussion - What have you been reading, and what do you think of it?",3
Part-time consulting work?,15
I made a Boolean string for your next job search!,115
Keep up with research?,10
Conferences?,4
Over half of the hiring managers I deal with,42
Employee engagement & integration in a new normal,9
A Novel Approach to Debriefing Medical Simulations: The Six Thinking Hats,2
Is the SIOP Career Center Worth the $$$?,4
Leader Transition Process,5
Looking for Resources and any Thoughts on using Sampling Weights in statistical analyses,5
What are you working on? - March 2022,7
User-generated questions for employee experience surveys?,8
What do IO psychologists really do?,19
Psychometrics Certification,3
Where to get an I/O Psychology License,0
Any advice for this newly admitted ph.d student?,14
"I'm looking for a Big 5 personality test that used either paired comparisons, forced-choice, or rank order techniques instead of the rating scale. Anyone here know of any?",3
Baseline assessment question,7
Is a Communication Studies BA helpful at all for an IO masters degree?,2
Motives and preference,7
The Public's Perception of those Diagnosed with Mental Health Disorders and their Ability to Reliably Testify in Court,1
"Bi-Weekly /r/IOpsychology Discussion - What have you been reading, and what do you think of it?",9
Trends in Organizational Attachment,4
Research trends in work-non work balance .,4
Reasons NOT to become an I/O Psychologist?,27
Research/Internships for Undergrads?,11
Effects of negative behavior or personality focused feedback at the workplace,12
Best pre-employment screening for testing cognition/personality? Preferably one that is free or reasonably priced.,1
How was finding a job for people who have experience in the I/O field?,18
"The Epidemic of Mental Disorders in Business—How Depression, Anxiety, and Stress Spread across Organizations through Employee Mobility",15
How to screen potential employees for conscientiousness without them realizing they're being tested and just putting the answers that the employer is looking for?,8
Michael Kraus drama,17
Intern jobs at PhD levels,2
Request for Resources on Applicant Selection Using Statistical Software,11
Intern Coordinator relevant applied experience?,7
Balancing practice with academia,10
Interesting articles on video-on meetings?,6
What do you wish you knew before your career in I/O psych?,36
IOs working remotely?,2
Request: Interview with an OD specialist,4
Available eBook : Recruitment and selection in Canada 7th edition,13
"In your (subjective or objective) opinion, what are the strengths and weaknesses of OB vs. IO training for academia?",7
Current status of the I/O psychologist in Australia?,5
21st Century Skills Assessments,1
I/O Syllabus,16
Where to start?..,7
"Bi-Weekly /r/IOpsychology Discussion - What have you been reading, and what do you think of it?",3
Hourly rate advice,7
Creating detailed job duties and tasks lists for a dozen positions,7
Tattoos as an IO,13
Organizational loyalty scale?,5
Where are we on leadership development?,8
Tips on focusing on the Organizational aspect in a career with I/O Psychology?,1
Should employees know that you are modeling them?,13
